{"candidate_item_count":622,"candidate_matched_count":296,"canonical_item_count":144,"canonical_matched_count":115,"canonical_promotion":"not_performed","field_evidence_count":296,"matched_count":411,"matching_policy":"exact_normalized_name_only_canonical_then_candidate","notes":"Canonical names and aliases take precedence. Candidate-name matches are secondary evidence only; unmatched and ambiguous rows require review and no vendor row is a canonical item.","review_count":1758,"snapshot_id":"vendor_skygame_data_1_3_4","snapshot_sha256":"21CCAD77006C425B27EE9314870BB5BB77E8436459C6DA214ABCB2B0D8329BBB","source_id":"source_skygame_data_1_3_4","status_counts":{"excluded_non_collectible":1508,"matched_candidate_name":296,"matched_canonical_name":115,"unmatched_vendor_item":1347},"unmatched_collectible_count":1347,"vendor_item_count":3266}
